author_id,item_id,item_url,title,authors,certificate_or_type,journal_name,journal_url,issue,issue_url,keywords,abstract,details_fetched
707733,79012915,https://elibrary.ru/item.asp?id=79012915,ИСПОЛЬЗОВАНИЕ ХРАНИЛИЩА ПАРАМЕТРОВ МАШИННОГО ОБУЧЕНИЯ ПРИ ГЕОИНФОРМАЦИОННОМ КАРТОГРАФИРОВАНИИ ТЕХНОГЕННО НАРУШЕННЫХ ТЕРРИТОРИЙ,"Колесников А.А., Кикин П.М., Платонов Т.А., Печенкина Е.В.",39. Фундаментальные и прикладные вопросы горных наук . 2024. Т. 11. № 4 . С. 88-94.,Фундаментальные и прикладные вопросы горных наук,https://elibrary.ru/contents.asp?id=79012899,№ 4,https://elibrary.ru/contents.asp?id=79012899&selid=79012915,ГЕОИНФОРМАЦИОННОЕ КАРТОГРАФИРОВАНИЕ; МАШИННОЕ ОБУЧЕНИЕ; ТЕХНОГЕННО НАРУШЕННЫЕ ТЕРРИТОРИИ СПУТНИКОВАЯ СЪЕМКА; СПЕКТРАЛЬНЫЕ ИНДЕКСЫ; ХРАНИЛИЩЕ ПАРАМЕТРОВ; FEATURE STORE,"Представленный подход к построению геоинформационных моделей и картографических материалов на основе систем хранилищ параметров (feature store) дает возможность объединить преимущества сложившихся методик по управлению данными, в том числе и пространственными, и их каталогизации с инструментарием геоинформационных систем. Предлагаемое решение, используемое при геоинформационном картографировании техногенно нарушенных территорий, позволяет создать универсальный каталог для различных систем обработки данных, унифицировав процессы предобработки спутниковых и аэрофотоснимков и упростив процесс подбора вариантов параметров при создании моделей методами машинного обучения. Приведена общая схема применения хранилища параметров совместно с геоинформационной системой. Описанные наборы параметров и процессы обработки пространственных данных реализованы на основе программного обеспечения Feast, PostgreSQL, QGIS.",1
707733,79012916,https://elibrary.ru/item.asp?id=79012916,ИСПОЛЬЗОВАНИЕ СИСТЕМ ГЕНЕРАЦИИ КОНТЕНТА В ЦИФРОВОЙ КАРТОГРАФИИ,"Комиссарова Е.В., Кикин П.М., Колесников А.А.",40. Фундаментальные и прикладные вопросы горных наук . 2024. Т. 11. № 4 . С. 95-101.,Фундаментальные и прикладные вопросы горных наук,https://elibrary.ru/contents.asp?id=79012899,№ 4,https://elibrary.ru/contents.asp?id=79012899&selid=79012916,АВТОМАТИЗАЦИЯ; ГЕОИНФОРМАТИКА; ИСКУССТВЕННЫЙ ИНТЕЛЛЕКТ; СИСТЕМЫ ГЕНЕРАЦИИ КОНТЕНТА; ЦИФРОВАЯ КАРТОГРАФИЯ,"Рассмотрены способы использования генеративных моделей в задачах обработки, анализа и визуализации пространственных данных. Структурированы направления применения систем генерации контента в картографии Приведены примеры для генерации картографических произведений, условных знаков, фотографий по данным геоинформационных моделей, географического описания территорий, стилизации растровых карт, улучшения качества сканированных картографических материалов и данных дистанционного зондирования. Предложены способы оценки сгенерированных картографических произведений, их стилизации, иллюстративных изображений на основе геоинформационных моделей. Проведенный анализ показал, что большинство перечисленных направлений применения генеративных моделей может сократить время рабочих процессов при создании картографических и геоинформационных произведений, но требуется использование механизма Retrieval Augmented Generation для формирования результатов с необходимой точностью.",1
707733,69920442,https://elibrary.ru/item.asp?id=69920442,"ПЕРВЫЕ ИТОГИ И ПЕРСПЕКТИВЫ РЕАЛИЗАЦИИ ООП МАГИСТРАТУРЫ 05.04.03 ""КАРТОГРАФИЯ И ГЕОИНФОРМАТИКА""","Пошивайло Я.Г., Колесников А.А.",41. Актуальные вопросы образования . 2024. № 1 . С. 186-191.,Актуальные вопросы образования,https://elibrary.ru/contents.asp?id=69920410,№ 1,https://elibrary.ru/contents.asp?id=69920410&selid=69920442,МАГИСТРАТУРА; СПЕЦИАЛИТЕТ; КАРТОГРАФИЯ И ГЕОИНФОРМАТИКА,"Статья посвящена вопросам подготовки кадров для геопространственной индустрии. Современное состояние образовательной системы в Российской Федерации характеризуется переходом от болонской системы к собственной образовательной системе, который, возможно будет иметь своим итогом восстановление специалитета для большинства технических направлений подготовки. Авторами представлены элементы разработанной образовательной программы магистратуры 05.04.03 «Картография и геоинформатика», приводится перечень профессиональных компетенций и структура блоков дисциплин. Сделан вывод о том, что используемая блочная структура программы магистратуры позволяет учитывать все основные направления в картографии и геоинформатике и давать актуальные теоретические и практические знания по разным направлениям дальнейшего профессионального развития. Представлена схема внедрения в учебный процесс свободно распространяемого или отечественного программного обеспечения, проанализированы аспекты такого перехода.",1
707733,67894854,https://elibrary.ru/item.asp?id=67894854,СРАВНИТЕЛЬНЫЙ АНАЛИЗ ПРОГРАММНЫХ ИНСТРУМЕНТОВ СОЗДАНИЯ КАРТ-ИСТОРИЙ,"Карташова К.В., Колесников А.А.",42. Вестник СГУГиТ (Сибирского государственного университета геосистем и технологий) . 2024. Т. 29. № 3 . С. 97-104.,Вестник СГУГиТ (Сибирского государственного университета геосистем и технологий),https://elibrary.ru/contents.asp?id=67894846,№ 3,https://elibrary.ru/contents.asp?id=67894846&selid=67894854,ТЕМАТИЧЕСКАЯ МУЛЬТИМЕДИЙНАЯ КАРТОГРАФИЯ; КАРТЫ-ИСТОРИИ; КАРТОГРАФИЧЕСКИЕ ВЕБ-СЕРВИСЫ; ВЕБ-КАРТОГРАФИЯ,"В наши дни многие пользователи, не имеющие специальной подготовки в области картографии и опыта в веб-дизайне, в состоянии создать несложную интерактивную карту, размещенную на одностраничном сайте, благодаря появлению специализированных веб-сервисов с различными функциональными возможностями и наборами шаблонов. В последние годы среди веб-карт появился новый вид, называемый картами-историями (сюжетные карты, Story Maps). Такие карты могут быть созданы как с помощью уже существующих веб-сервисов (конструкторов карт), так и самостоятельно. Цель настоящего исследования - осуществить поиск, изучить и выполнить сравнительный анализ типовых инструментов создания и использования карт-историй, выявить их сильные и слабые стороны, выделить основные признаки и особенности таких карт. В работе рассматриваются как существующие инструменты создания карт-историй с помощью веб-сервисов, так и возможности разработки таких карт самостоятельно с использованием открытого программного обеспечения. Приведен сравнительный анализ функциональных возможностей веб-сервисов ArcGIS StoryMaps и Knightlab StoryMap JS по созданию карт-историй. Также проанализированы веб-инструменты по созданию временных шкал - Knightlab Timeline JS и Tiki Toki.",1
707733,56007630,https://elibrary.ru/item.asp?id=56007630,"СПОСОБ ПОЛУЧЕНИЯ, ОБРАБОТКИ, ОТОБРАЖЕНИЯ И ИНТЕРПРЕТАЦИИ ГЕОПРОСТРАНСТВЕННЫХ ДАННЫХ ДЛЯ КЛАСТЕРИЗАЦИИ НЕОДНОРОДНОСТИ ТЕХНОГЕННО ИЗМЕНЕННЫХ ТЕРРИТОРИЙ","Резник А.В., Гаврилов В.Л., Немова Н.А., Косарев Н.С., Колесников А.А.","43. Патент на изобретение RU 2806406 C1, 31.10.2023. Заявка № 2022125547 от 30.09.2022.",,,,,,"Изобретение относится к способам геодезического мониторинга и цифрового геоинформационного мониторинга техногенно измененных территорий с использованием геодезических и маркшейдерских средств, используется для контроля, оценки и прогнозирования состояния неоднородной по строению и структуре техногенно измененной земной поверхности. Способ включает сбор и анализ высокоточных геопространственных, атмосферных и подземных данных, кластеризацию техногенно измененной территории, по результатам которой формируют базу нарушенных территорий и механизмы запросов к ней, после чего с помощью интерфейсной подсистемы прогнозируют состояние территории, выполняют построение динамически изменяющейся трехмерной модели на основе результатов прогноза состояния, используя отдельный модуль программного обеспечения. Технический результат – повышении эффективности способа получения, обработки, отображения и интерпретации геопространственных данных для кластеризации неоднородности техногенно измененных территорий, полученных с помощью методов высокоточного позиционирования, разного масштаба для мониторинга и управления техногенно измененной территорией.",1
707733,56011780,https://elibrary.ru/item.asp?id=56011780,ТЕХНОГЕННО-ИЗМЕНЕННЫЕ ЗЕМЛИ ПРИ ДОБЫЧЕ И ИСПОЛЬЗОВАНИИ ТВЕРДЫХ ПОЛЕЗНЫХ ИСКОПАЕМЫХ НА ТЕРРИТОРИИ НОВОСИБИРСКОЙ ОБЛАСТИ,"Резник А.В., Немова Н.А., Косарев Н.С., Колесников А.А., Медведева К.Е., Платонов Т.А., Гаврилов В.Л.","44. Свидетельство о регистрации базы данных RU 2023624553, 11.12.2023. Заявка № 2023624542 от 28.11.2023.",,,,,,"База данных содержит информацию о разрабатываемых и перспективных для освоения твердых полезных ископаемых месторождениях и участках недр Новосибирской области, о техногенно измененных землях при ведении горных работ, переработке и использовании твердых полезных ископаемых в различных направлениях. Данные получены из различных источников (публикации, отчёты, проекты, фондовые материалы, Интернет ресурсы, аэрокосмические снимки и др.), включают карту с объектами, взаимосвязанные и взаимодополняющие таблицы с: географическими, природно-климатическими характеристиками и параметрами, площадями нарушений земель различного назначения. База данных предназначена для информационно- аналитической поддержки специалистов при: оценке различных аспектов и этапов освоения месторождений Новосибирской области, рекультивации техногенно нарушенных земель; проведении научных, проектных, производственных, экспертных и образовательных работ, подготовке и составлении обзоров, публикаций, отчётов, статей, справок, заключений; оперативном изучении новой проблематики и т.п. Полнотекстовый многоуровневый поиск необходимой пользователю информации осуществляется с помощью программного обеспечения, обеспечивающего индексирование базы и быстрый поиск по содержимому с помощью формальных текстовых запросов. База данных предусматривает постоянную актуализацию, корректировку и пополнение. Тип ЭВМ: IBM PC-совмест. ПК; ОС: Windows, Linux.",1
707733,56013917,https://elibrary.ru/item.asp?id=56013917,ПРОГРАММА ДЛЯ ФОРМИРОВАНИЯ БАЗЫ ДАННЫХ СОЦИАЛЬНО-ЭКОНОМИЧЕСКИХ ПОКАЗАТЕЛЕЙ НОВОСИБИРСКОЙ ОБЛАСТИ ПО ДАННЫМ ИЗ ОТКРЫТЫХ ИСТОЧНИКОВ,Колесников А.А.,"45. Свидетельство о регистрации программы для ЭВМ RU 2023686176, 04.12.2023. Заявка № 2023685838 от 22.11.2023.",,,,,,"Программа предназначена для формирования базы данных в виде структурированного JSON-файла социально-экономических показателей Новосибирской области по данным из открытых источников, представленных Федеральной службой государственной статистики по Новосибирской области. Программу предполагается использовать для автоматизации сбора и обработки данных при разработке и создании атласа по дисциплине «Окружающий мир» для начальной школы в рамках гранта Правительства Новосибирской области молодым ученым. Функциональные возможности программы: получение xlsx файлов с сайта Федеральной службы государственной статистики по Новосибирской области, извлечение данных по указанным районам Новосибирской области, преобразование значений в двумерный массив, выгрузка массива в файлы формата JSON. Тип ЭВМ: IBM PC совмест. с ПК. ОС: Windows 7 и выше.",1
707733,56013990,https://elibrary.ru/item.asp?id=56013990,ПРОГРАММА ДЛЯ ИЗВЛЕЧЕНИЯ И КООРДИНИРОВАНИЯ ГЕОГРАФИЧЕСКИХ ОБЪЕКТОВ ИЗ НЕСТРУКТУРИРОВАННОГО ТЕКСТА,Колесников А.А.,"46. Свидетельство о регистрации программы для ЭВМ RU 2023686249, 05.12.2023. Заявка № 2023686275 от 05.12.2023.",,,,,,"Программа предназначена для обработки произвольного неструктурированного текста, выделения из него наименований географических объектов посредством технологий машинного обучения и их последующего геокодирования с целью получения географических координат. Программа предназначена для автоматизации обработки различных текстовых данных и формирования на их основе пространственных БД объектов. Программа может использоваться в качестве функционального элемента геоинформационной системы или сервиса, поскольку представляет собой подготовленный docker-образ, реализующий интерфейс взаимодействия через API на основе FastAPI. Функциональные возможности программы: извлечение наименований географических объектов из неструктурированного текста на основе NER технологий машинного обучения, геокодирование географических объектов, интерфейс взаимодействия с внешними программами через GET и POST запросы",1
707733,56014007,https://elibrary.ru/item.asp?id=56014007,ПРОГРАММА ДЛЯ ПОСТРОЕНИЯ WEB-СЕРВИСА СБОРА И ОБРАБОТКИ ОТКРЫТЫХ КЛИМАТИЧЕСКИХ ДАННЫХ ДИСТАНЦИОННОГО ЗОНДИРОВАНИЯ,Колесников А.А.,"47. Свидетельство о регистрации программы для ЭВМ RU 2023686266, 05.12.2023. Заявка № 2023686290 от 05.12.2023.",,,,,,"Программа это компонент ГИС или сетевого сервиса и реализует функции обращения к открытым климатическим данным дистанционного зондирования, их получения, обработки и сохранения в виде геопривязанных файлов формата GeoTIFF. ПО может найти применение в ГИС, ориентированных на мониторинг и прогнозирование состояний окружающей среды и отдельных экологических показателей. Программа может использоваться в качестве функционального элемента ГИС или сервиса, поскольку представляет собой подготовленный docker-образ, реализующий интерфейс взаимодействия через API на основе FastAPI. Функциональные возможности: извлечение климатических показателей на основе данных дистанционного зондирования из открытых источников, сохранение массивов данных в файлы формата GeoTIFF, интерфейс взаимодействия с внешними программами через GET и POST запросы",1
707733,56016056,https://elibrary.ru/item.asp?id=56016056,МОДУЛЬ QGIS КОНВЕРТАЦИИ КАРТОГРАФИЧЕСКИХ ОБЪЕКТОВ В ФОРМАТ BI-СИСТЕМ ДЛЯ ФОРМИРОВАНИЯ WEB-ВЕРСИИ АТЛАСА НОВОСИБИРСКОЙ ОБЛАСТИ,Колесников А.А.,"48. Свидетельство о регистрации программы для ЭВМ RU 2023688144, 20.12.2023. Заявка № 2023687911 от 18.12.2023.",,,,,,"Программа представляет собой модуль геоинформационной системы QGIS и предназначена для конвертации картографических объектов векторного слоя в формат хранения подходящий для BI-систем, в частности Яндекс DataLens. Программу предполагается использовать в процессах подготовки векторных данных при разработке и создании web-версии атласа по дисциплине «Окружающий мир» для начальной школы в рамках гранта Правительства Новосибирской области молодым ученым. Функциональные возможности программы: обработка и извлечение координат узлов геометрии векторных картографических объектов, формирование описания (метрического и атрибутивного) картографических объектов в формате BI-систем, выгрузка сформированного массива данных в файл формата CSV. Тип ЭВМ: IBM PC-совмест. ПК. ОС: Windows 7 и выше, QGIS 3.20 и выше.",1
