author_id,item_id,item_url,title,authors,certificate_or_type,journal_name,journal_url,issue,issue_url
707733,69920442,https://elibrary.ru/item.asp?id=69920442,"ПЕРВЫЕ ИТОГИ И ПЕРСПЕКТИВЫ РЕАЛИЗАЦИИ ООП МАГИСТРАТУРЫ 05.04.03 ""КАРТОГРАФИЯ И ГЕОИНФОРМАТИКА""","Пошивайло Я.Г., Колесников А.А.",41. Актуальные вопросы образования . 2024. № 1 . С. 186-191.,Актуальные вопросы образования,https://elibrary.ru/contents.asp?id=69920410,№ 1,https://elibrary.ru/contents.asp?id=69920410&selid=69920442
707733,67894854,https://elibrary.ru/item.asp?id=67894854,СРАВНИТЕЛЬНЫЙ АНАЛИЗ ПРОГРАММНЫХ ИНСТРУМЕНТОВ СОЗДАНИЯ КАРТ-ИСТОРИЙ,"Карташова К.В., Колесников А.А.",42. Вестник СГУГиТ (Сибирского государственного университета геосистем и технологий) . 2024. Т. 29. № 3 . С. 97-104.,Вестник СГУГиТ (Сибирского государственного университета геосистем и технологий),https://elibrary.ru/contents.asp?id=67894846,№ 3,https://elibrary.ru/contents.asp?id=67894846&selid=67894854
707733,56007630,https://elibrary.ru/item.asp?id=56007630,"СПОСОБ ПОЛУЧЕНИЯ, ОБРАБОТКИ, ОТОБРАЖЕНИЯ И ИНТЕРПРЕТАЦИИ ГЕОПРОСТРАНСТВЕННЫХ ДАННЫХ ДЛЯ КЛАСТЕРИЗАЦИИ НЕОДНОРОДНОСТИ ТЕХНОГЕННО ИЗМЕНЕННЫХ ТЕРРИТОРИЙ","Резник А.В., Гаврилов В.Л., Немова Н.А., Косарев Н.С., Колесников А.А.","43. Патент на изобретение RU 2806406 C1, 31.10.2023. Заявка № 2022125547 от 30.09.2022.",,,,
707733,56011780,https://elibrary.ru/item.asp?id=56011780,ТЕХНОГЕННО-ИЗМЕНЕННЫЕ ЗЕМЛИ ПРИ ДОБЫЧЕ И ИСПОЛЬЗОВАНИИ ТВЕРДЫХ ПОЛЕЗНЫХ ИСКОПАЕМЫХ НА ТЕРРИТОРИИ НОВОСИБИРСКОЙ ОБЛАСТИ,"Резник А.В., Немова Н.А., Косарев Н.С., Колесников А.А., Медведева К.Е., Платонов Т.А., Гаврилов В.Л.","44. Свидетельство о регистрации базы данных RU 2023624553, 11.12.2023. Заявка № 2023624542 от 28.11.2023.",,,,
707733,56013917,https://elibrary.ru/item.asp?id=56013917,ПРОГРАММА ДЛЯ ФОРМИРОВАНИЯ БАЗЫ ДАННЫХ СОЦИАЛЬНО-ЭКОНОМИЧЕСКИХ ПОКАЗАТЕЛЕЙ НОВОСИБИРСКОЙ ОБЛАСТИ ПО ДАННЫМ ИЗ ОТКРЫТЫХ ИСТОЧНИКОВ,Колесников А.А.,"45. Свидетельство о регистрации программы для ЭВМ RU 2023686176, 04.12.2023. Заявка № 2023685838 от 22.11.2023.",,,,
707733,56013990,https://elibrary.ru/item.asp?id=56013990,ПРОГРАММА ДЛЯ ИЗВЛЕЧЕНИЯ И КООРДИНИРОВАНИЯ ГЕОГРАФИЧЕСКИХ ОБЪЕКТОВ ИЗ НЕСТРУКТУРИРОВАННОГО ТЕКСТА,Колесников А.А.,"46. Свидетельство о регистрации программы для ЭВМ RU 2023686249, 05.12.2023. Заявка № 2023686275 от 05.12.2023.",,,,
707733,56014007,https://elibrary.ru/item.asp?id=56014007,ПРОГРАММА ДЛЯ ПОСТРОЕНИЯ WEB-СЕРВИСА СБОРА И ОБРАБОТКИ ОТКРЫТЫХ КЛИМАТИЧЕСКИХ ДАННЫХ ДИСТАНЦИОННОГО ЗОНДИРОВАНИЯ,Колесников А.А.,"47. Свидетельство о регистрации программы для ЭВМ RU 2023686266, 05.12.2023. Заявка № 2023686290 от 05.12.2023.",,,,
707733,56016056,https://elibrary.ru/item.asp?id=56016056,МОДУЛЬ QGIS КОНВЕРТАЦИИ КАРТОГРАФИЧЕСКИХ ОБЪЕКТОВ В ФОРМАТ BI-СИСТЕМ ДЛЯ ФОРМИРОВАНИЯ WEB-ВЕРСИИ АТЛАСА НОВОСИБИРСКОЙ ОБЛАСТИ,Колесников А.А.,"48. Свидетельство о регистрации программы для ЭВМ RU 2023688144, 20.12.2023. Заявка № 2023687911 от 18.12.2023.",,,,
707733,59992333,https://elibrary.ru/item.asp?id=59992333,ЦИФРОВАЯ КАРТОГРАФИЯ,"Андрюхина Ю.Н., Бугаков П.Ю., Касьянова Е.Л., Кацко С.Ю., Колесников А.А., Комиссарова Е.В., Лисицкий Д.В., Молокина Т.С., Радченко Л.К., Пошивайло Я.Г., Утробина Е.С., Янкелевич С.С.","49. Новосибирск, 2023.",,,,
707733,62909297,https://elibrary.ru/item.asp?id=62909297,МЕТОДИЧЕСКИЙ ПОДХОД К ОЦЕНКЕ ВЛИЯНИЯ ТЕХНОГЕННО-ИЗМЕНЕННЫХ ТЕРРИТОРИЙ НА ООПТ НОВОСИБИРСКОЙ ОБЛАСТИ,"Колесников А.А., Косарев Н.С.","50. В сборнике: Устойчивое развитие особо охраняемых природных территорий. Сборник статей Х Юбилейной национальной научно-практической конференции. Сочи, 2023. С. 173-178.",,,,
707733,53974395,https://elibrary.ru/item.asp?id=53974395,АВТОМАТИЗАЦИЯ СБОРА ДАННЫХ ИЗ ОТКРЫТЫХ ИСТОЧНИКОВ О СОСТОЯНИИ ТЕХНОГЕННО-НАРУШЕННЫХ ТЕРРИТОРИЙ С ИСПОЛЬЗОВАНИЕМ ГЕОИНФОРМАЦИОННЫХ ТЕХНОЛОГИЙ И МИКРОСЕРВИСНЫХ АРХИТЕКТУР,"Колесников А.А., Косарев Н.С., Платонов Т.А.","51. В сборнике: Цифровые технологии в горном деле. Тезисы докладов Всероссийской научно-технической конференции. Апатиты, 2023. С. 24-25.",,,,
707733,54650528,https://elibrary.ru/item.asp?id=54650528,МОНИТОРИНГ И АНАЛИЗ ИЗМЕНЕНИЙ ТЕХНОГЕННО-НАРУШЕННЫХ ТЕРРИТОРИЙ,"Колесников А.А., Косарев Н.С.","52. В сборнике: Обработка пространственных данных в задачах мониторинга природных и антропогенных процессов (SDM-2023). сборник трудов всероссийской конференции с международным участием. Новосибирск, 2023. С. 263-267.",,,,
707733,58905362,https://elibrary.ru/item.asp?id=58905362,ИСПОЛЬЗОВАНИЕ ГЕОПРОСТРАНСТВЕНЫХ ДАННЫХ ДЛЯ ОЦЕНКИ СОСТОЯНИЯ ТЕХНОГЕННО НАРУШЕННЫХ ЗЕМЕЛЬ,"Косарев Н.С., Колесников А.А., Резник А.В., Немова Н.А., Ожигин Д.С.",53. Физико-технические проблемы разработки полезных ископаемых . 2023. № 6 . С. 190-197. Версии:,Физико-технические проблемы разработки полезных ископаемых,https://elibrary.ru/contents.asp?id=58905305,№ 6,https://elibrary.ru/contents.asp?id=58905305&selid=58905362
707733,53982491,https://elibrary.ru/item.asp?id=53982491,СОВРЕМЕННЫЕ ПОДХОДЫ К АВТОМАТИЗАЦИИ ОПЕРАЦИЙ ПО РЕДАКТИРОВАНИЮ ПРОСТРАНСТВЕННЫХ ДАННЫХ,Колесников А.А.,54. Геодезия и картография . 2023. Т. 84. № 4 . С. 39-49.,Геодезия и картография,https://elibrary.ru/contents.asp?id=53982485,№ 4,https://elibrary.ru/contents.asp?id=53982485&selid=53982491
707733,54107474,https://elibrary.ru/item.asp?id=54107474,ТЕХНИЧЕСКИЕ РЕШЕНИЯ ДЛЯ СОЗДАНИЯ КАРТОГРАФИЧЕСКИХ БАЗ ДАННЫХ НА ОСНОВЕ НЕСТРУКТУРИРОВАННОГО ТЕКСТА С ИСПОЛЬЗОВАНИЕМ МИКРОСЕРВИСНОЙ АРХИТЕКТУРЫ И СИСТЕМ ОБРАБОТКИ ЕСТЕСТВЕННОГО ЯЗЫКА,Колесников А.А.,55. Информация и космос . 2023. № 2 . С. 132-136.,Информация и космос,https://elibrary.ru/contents.asp?id=54107455,№ 2,https://elibrary.ru/contents.asp?id=54107455&selid=54107474
707733,54597875,https://elibrary.ru/item.asp?id=54597875,МЕТОДИКА ИСПОЛЬЗОВАНИЯ ТУРИСТСКОЙ КАРТЫ ЧЕРЕЗ ПРИЛОЖЕНИЕ С ДОПОЛНЕННОЙ РЕАЛЬНОСТЬЮ ПО РАЗРАБОТАННОЙ ТЕХНОЛОГИЧЕСКОЙ СХЕМЕ СОЗДАНИЯ КАРТЫ,"Ажилай А.А., Комиссарова Е.В., Колесников А.А.",56. Интерэкспо Гео-Сибирь . 2023. Т. 1. № 2 . С. 101-110.,Интерэкспо Гео-Сибирь,https://elibrary.ru/contents.asp?id=54597859,№ 2,https://elibrary.ru/contents.asp?id=54597859&selid=54597875
707733,54597879,https://elibrary.ru/item.asp?id=54597879,ПОДГОТОВКА И ВИЗУАЛИЗАЦИЯ ПРОСТРАНСТВЕННЫХ ДАННЫХ В РЕДАКТОРАХ ТРЕХМЕРНОЙ ГРАФИКИ,"Колесников А.А., Пономарёв А.В.",57. Интерэкспо Гео-Сибирь . 2023. Т. 1. № 2 . С. 131-136.,Интерэкспо Гео-Сибирь,https://elibrary.ru/contents.asp?id=54597859,№ 2,https://elibrary.ru/contents.asp?id=54597859&selid=54597879
707733,54597880,https://elibrary.ru/item.asp?id=54597880,РАЗРАБОТКА ТУРИСТКОЙ ИНТЕРАКТИВНОЙ ВЕБ-КАРТЫ КЕМЕРОВСКОЙ ОБЛАСТИ,"Колесников А.А., Попов В.П.",58. Интерэкспо Гео-Сибирь . 2023. Т. 1. № 2 . С. 137-143.,Интерэкспо Гео-Сибирь,https://elibrary.ru/contents.asp?id=54597859,№ 2,https://elibrary.ru/contents.asp?id=54597859&selid=54597880
707733,54597881,https://elibrary.ru/item.asp?id=54597881,ОЦЕНКА ВЛИЯНИЯ КОЛИЧЕСТВА ИНФОРМАЦИИ НА КАЧЕСТВО АВТОМАТИЗИРОВАННОГО ДЕШИФРИРОВАНИЯ СПУТНИКОВЫХ СНИМКОВ,"Коломеец М.В., Колесников А.А.",59. Интерэкспо Гео-Сибирь . 2023. Т. 1. № 2 . С. 144-150.,Интерэкспо Гео-Сибирь,https://elibrary.ru/contents.asp?id=54597859,№ 2,https://elibrary.ru/contents.asp?id=54597859&selid=54597881
707733,54360976,https://elibrary.ru/item.asp?id=54360976,МЕТОДИКА ИСПОЛЬЗОВАНИЯ МОБИЛЬНЫХ УСТРОЙСТВ ПРИ ВЫПОЛНЕНИИ ПРАКТИЧЕСКИХ РАБОТ,"Гонец Г.И., Комиссарова Е.В., Колесников А.А.",60. Актуальные вопросы образования . 2023. № 3 . С. 17-24.,Актуальные вопросы образования,https://elibrary.ru/contents.asp?id=54360972,№ 3,https://elibrary.ru/contents.asp?id=54360972&selid=54360976
707733,54751053,https://elibrary.ru/item.asp?id=54751053,СОЗДАНИЕ БАЗЫ ДАННЫХ ТЕХНОГЕННО-НАРУШЕННЫХ ТЕРРИТОРИЙ НОВОСИБИРСКОЙ ОБЛАСТИ,"Колесников А.А., Косарев Н.С., Немова Н.А., Резник А.В., Платонов Т.А.",61. Вестник СГУГиТ (Сибирского государственного университета геосистем и технологий) . 2023. Т. 28. № 5 . С. 80-92.,Вестник СГУГиТ (Сибирского государственного университета геосистем и технологий),https://elibrary.ru/contents.asp?id=54751045,№ 5,https://elibrary.ru/contents.asp?id=54751045&selid=54751053
707733,65596569,https://elibrary.ru/item.asp?id=65596569,СПОСОБЫ ИЗВЛЕЧЕНИЯ МЕТАДАННЫХ О ПРОСТРАНСТВЕННОМ ПОЛОЖЕНИИ ИЗ ХРАНИЛИЩ ФОТОГРАФИЙ,"Гришин Р.В., Колесников А.А.",62. Вестник СГУГиТ (Сибирского государственного университета геосистем и технологий) . 2023. Т. 28. № 6 . С. 57-66.,Вестник СГУГиТ (Сибирского государственного университета геосистем и технологий),https://elibrary.ru/contents.asp?id=65596563,№ 6,https://elibrary.ru/contents.asp?id=65596563&selid=65596569
707733,65596572,https://elibrary.ru/item.asp?id=65596572,ОЦЕНКА ОБЕСПЕЧЕННОСТИ ТЕРРИТОРИИ ГОРОДА РЕКРЕАЦИОННЫМИ ОБЪЕКТАМИ ДЛЯ ПЕРСПЕКТИВНОГО ПЛАНИРОВАНИЯ ОРГАНИЗАЦИИ ЗЕМЛЕПОЛЬЗОВАНИЯ,"Дубровский А.В., Ершов А.В., Малыгина О.И., Стегниенко Е.С., Колесников А.А., Татаренко В.И.",63. Вестник СГУГиТ (Сибирского государственного университета геосистем и технологий) . 2023. Т. 28. № 6 . С. 86-98.,Вестник СГУГиТ (Сибирского государственного университета геосистем и технологий),https://elibrary.ru/contents.asp?id=65596563,№ 6,https://elibrary.ru/contents.asp?id=65596563&selid=65596572
707733,54798158,https://elibrary.ru/item.asp?id=54798158,О НЕОБХОДИМОСТИ КОМПЛЕКСНОЙ ГЕОЭКОЛОГИЧЕСКОЙ ОЦЕНКИ ТЕХНОГЕННО НАРУШЕННЫХ ГОРНЫМИ РАБОТАМИ ЗЕМЕЛЬ,"Гаврилов В.Л., Немова Н.А., Резник А.В., Косарев Н.С., Колесников А.А.",64. Известия Томского политехнического университета. Инжиниринг георесурсов . 2023. Т. 334. № 10 . С. 76-87.,Известия Томского политехнического университета. Инжиниринг георесурсов,https://elibrary.ru/contents.asp?id=54798151,№ 10,https://elibrary.ru/contents.asp?id=54798151&selid=54798158
707733,49445825,https://elibrary.ru/item.asp?id=49445825,СПОСОБ ОПРЕДЕЛЕНИЯ МЕСТОПОЛОЖЕНИЯ ПОЛЬЗОВАТЕЛЯ ПРИ ОРИЕНТИРОВАНИИ НА МЕСТНОСТИ В ИНТЕРАКТИВНОМ РЕЖИМЕ В УСЛОВИЯХ ОТСУТСТВИЯ СВЯЗИ ДЛЯ ПЕРЕДАЧИ ЦИФРОВЫХ ДАННЫХ,"Лисицкий Д.В., Колесников А.А.","65. Патент на изобретение RU 2779812 C1, 13.09.2022. Заявка № 2021137066 от 15.12.2021.",,,,
707733,49978724,https://elibrary.ru/item.asp?id=49978724,"МОДЕЛИРОВАНИЕ ПРОСТРАНСТВЕННОГО ПОЛОЖЕНИЯ ЗОН ДОСТУПНОСТИ ОБЪЕКТОВ РЕКРЕАЦИИ ""РЕКРЕАЦИЯ В ШАГЕ""","Дубровский А.В., Колесников А.А., Стегниенко Е.С., Ершов А.В.","66. Свидетельство о регистрации программы для ЭВМ RU 2022683816, 08.12.2022. Заявка № 2022683871 от 08.12.2022.",,,,
707733,49890126,https://elibrary.ru/item.asp?id=49890126,ТЕХНОЛОГИЧЕСКИЕ ПОДХОДЫ К СБОРУ И ОБРАБОТКЕ ПРОСТРАНСТВЕННЫХ ДАННЫХ ПРИ СОЗДАНИИ ГЕОИНФОРМАЦИОННОЙ МОДЕЛИ ГИДРОТЕХНИЧЕСКИХ СООРУЖЕНИЙ,"Пошивайло Я.Г., Колесников А.А.","67. В сборнике: Тематические карты и атласы: современные концепции научного содержания, новые технологии создания и использования. Материалы XI международной научной конференции по тематической картографии. Иркутск, 2022. С. 195-196.",,,,
707733,49387557,https://elibrary.ru/item.asp?id=49387557,ОБЗОР СОСТОЯНИЯ ТЕХНОЛОГИИ ДОПОЛНЕННОЙ РЕАЛЬНОСТИ В ТУРИСТСКОЙ КАРТОГРАФИИ,"Ажилай А.А., Комиссарова Е.В., Колесников А.А.",68. Интерэкспо Гео-Сибирь . 2022. Т. 1. С. 169-179.,Интерэкспо Гео-Сибирь,https://elibrary.ru/contents.asp?id=49387533,,
707733,49431530,https://elibrary.ru/item.asp?id=49431530,РАЗРАБОТКА ПРОГРАММНОЙ ПЛАТФОРМЫ ДЛЯ ТЕХНИЧЕСКОЙ ПОДДЕРЖКИ ОРГАНИЗАЦИИ И ПРОВЕДЕНИЯ СТУДЕНЧЕСКОЙ НАУЧНОЙ КОНФЕРЕНЦИИ,"Бугаков П.Ю., Бугакова Т.Ю., Колесников А.А., Шарапов А.А.",69. Интерэкспо Гео-Сибирь . 2022. Т. 7. № 1 . С. 175-184.,Интерэкспо Гео-Сибирь,https://elibrary.ru/contents.asp?id=49431502,№ 1,https://elibrary.ru/contents.asp?id=49431502&selid=49431530
707733,49274758,https://elibrary.ru/item.asp?id=49274758,"АВТОМАТИЗИРОВАННАЯ СИСТЕМА СБОРА И ОБРАБОТКИ ОРГАНИЗАЦИОННЫХ ДАННЫХ СТУДЕНЧЕСКОЙ НАУЧНОЙ КОНФЕРЕНЦИИ ""СНК-2022""","Бугакова Т.Ю., Колесников А.А., Шарапов А.А., Бугаков П.Ю.",70. Актуальные вопросы образования . 2022. № 1 . С. 192-198.,Актуальные вопросы образования,https://elibrary.ru/contents.asp?id=49274727,№ 1,https://elibrary.ru/contents.asp?id=49274727&selid=49274758
707733,49274768,https://elibrary.ru/item.asp?id=49274768,"НАУЧНО-ПРАКТИЧЕСКИЙ СТУДЕНЧЕСКИЙ ПРОЕКТ ""СОЗДАНИЕ ВИРТУАЛЬНЫХ ПАНОРАМ""","Колесников А.А., Пошивайло Я.Г., Утробина Е.С.",71. Актуальные вопросы образования . 2022. № 1 . С. 251-258.,Актуальные вопросы образования,https://elibrary.ru/contents.asp?id=49274727,№ 1,https://elibrary.ru/contents.asp?id=49274727&selid=49274768
707733,49274728,https://elibrary.ru/item.asp?id=49274728,АНАЛИЗ ПЕРСПЕКТИВНЫХ НАПРАВЛЕНИЙ АВТОМАТИЗАЦИИ ОБЕСПЕЧЕНИЯ УЧЕБНОГО ПРОЦЕССА СГУГИТ В ЦЕЛЯХ СОКРАЩЕНИЯ ЗАТРАТ РАБОЧЕГО ВРЕМЕНИ ПРОФЕССОРСКО-ПРЕПОДАВАТЕЛЬСКОГО СОСТАВА,"Пошивайло Я.Г., Колесников А.А.",72. Актуальные вопросы образования . 2022. № 1 . С. 3-8.,Актуальные вопросы образования,https://elibrary.ru/contents.asp?id=49274727,№ 1,https://elibrary.ru/contents.asp?id=49274727&selid=49274728
707733,49297324,https://elibrary.ru/item.asp?id=49297324,ОПЫТ ПРОВЕДЕНИЯ ЛЕТНИХ УЧЕБНЫХ ПРАКТИК В ДИСТАНЦИОННОМ ФОРМАТЕ ДЛЯ ОБУЧАЮЩИХСЯ ПО НАПРАВЛЕНИЮ ПОДГОТОВКИ 05.03.03 КАРТОГРАФИЯ И ГЕОИНФОРМАТИКА,"Утробина Е.С., Колесников А.А., Пошивайло Я.Г.",73. Актуальные вопросы образования . 2022. № 2 . С. 100-107.,Актуальные вопросы образования,https://elibrary.ru/contents.asp?id=49297304,№ 2,https://elibrary.ru/contents.asp?id=49297304&selid=49297324
707733,49295823,https://elibrary.ru/item.asp?id=49295823,АНАЛИЗ МЕТОДОВ И СРЕДСТВ ИСКУССТВЕННОГО ИНТЕЛЛЕКТА ДЛЯ АНАЛИЗА И ИНТЕРПРЕТАЦИИ ДАННЫХ АКТИВНОГО ДИСТАНЦИОННОГО ЗОНДИРОВАНИЯ,Колесников А.А.,74. Вестник СГУГиТ (Сибирского государственного университета геосистем и технологий) . 2022. Т. 27. № 3 . С. 74-94.,Вестник СГУГиТ (Сибирского государственного университета геосистем и технологий),https://elibrary.ru/contents.asp?id=49295816,№ 3,https://elibrary.ru/contents.asp?id=49295816&selid=49295823
707733,49295824,https://elibrary.ru/item.asp?id=49295824,ВОЗМОЖНОСТИ NOSQL СУБД ДЛЯ ОБРАБОТКИ ПРОСТРАНСТВЕННЫХ ДАННЫХ,Колесников А.А.,75. Вестник СГУГиТ (Сибирского государственного университета геосистем и технологий) . 2022. Т. 27. № 3 . С. 95-106.,Вестник СГУГиТ (Сибирского государственного университета геосистем и технологий),https://elibrary.ru/contents.asp?id=49295816,№ 3,https://elibrary.ru/contents.asp?id=49295816&selid=49295824
707733,49605417,https://elibrary.ru/item.asp?id=49605417,ПРИМЕНЕНИЕ ВИРТУАЛЬНЫХ ПАНОРАМ В ЦИФРОВОМ ТЕМАТИЧЕСКОМ КАРТОГРАФИРОВАНИИ,"Колесников А.А., Пошивайло Я.Г., Утробина Е.С., Миронова С.А.",76. Вестник СГУГиТ (Сибирского государственного университета геосистем и технологий) . 2022. Т. 27. № 4 . С. 74-87.,Вестник СГУГиТ (Сибирского государственного университета геосистем и технологий),https://elibrary.ru/contents.asp?id=49605409,№ 4,https://elibrary.ru/contents.asp?id=49605409&selid=49605417
707733,49821053,https://elibrary.ru/item.asp?id=49821053,АВТОМАТИЗАЦИЯ ПОДГОТОВКИ КАРТОГРАФИЧЕСКИХ ДАННЫХ С ПОМОЩЬЮ СИСТЕМ ОБРАБОТКИ ЕСТЕСТВЕННОГО ЯЗЫКА,"Колесников А.А., Плитченко Е.А., Кропачева М.К.",77. ИнтерКарто. ИнтерГИС . 2022. Т. 28. № 1 . С. 659-669.,ИнтерКарто. ИнтерГИС,https://elibrary.ru/contents.asp?id=49820999,№ 1,https://elibrary.ru/contents.asp?id=49820999&selid=49821053
707733,45822239,https://elibrary.ru/item.asp?id=45822239,ПРОГРАММНОЕ РАСШИРЕНИЕ ДЛЯ РАСЧЕТА ПЛОЩАДИ ЗЕМЕЛЬНЫХ УЧАСТКОВ В БАЛЛО-ГЕКТАРАХ В ГИС MAPINFO PROFESSIONAL,"Колесников А.А., Клюшниченко В.Н.","78. Свидетельство о регистрации программы для ЭВМ RU 2021616079, 16.04.2021. Заявка № 2021615387 от 16.04.2021.",,,,
707733,45822242,https://elibrary.ru/item.asp?id=45822242,МОДУЛЬ РАСЧЕТА ПЛОЩАДИ ЗЕМЕЛЬНЫХ УЧАСТКОВ В БАЛЛО-ГЕКТАРАХ ДЛЯ ГИС АКСИОМА,"Колесников А.А., Клюшниченко В.Н.","79. Свидетельство о регистрации программы для ЭВМ RU 2021616082, 16.04.2021. Заявка № 2021615401 от 16.04.2021.",,,,
707733,46477575,https://elibrary.ru/item.asp?id=46477575,СПОСОБ СОЗДАНИЯ АВТОНОМНОГО ИСТОЧНИКА ГЕОПРОСТРАНСТВЕННОЙ ИНФОРМАЦИИ И ИСПОЛЬЗОВАНИЯ ЕГО В ИНТЕРАКТИВНОМ РЕЖИМЕ В УСЛОВИЯХ ОТСУТСТВИЯ СВЯЗИ ДЛЯ ПЕРЕДАЧИ ЦИФРОВЫХ ДАННЫХ,"Лисицкий Д.В., Комиссарова Е.В., Колесников А.А.","80. Патент на изобретение RU 2752606 C2, 29.07.2021. Заявка № 2019120894 от 02.07.2019.",,,,
707733,47121531,https://elibrary.ru/item.asp?id=47121531,"СПОСОБ ОПРЕДЕЛЕНИЯ МЕСТОПОЛОЖЕНИЯ НА ТРАДИЦИОННОЙ КАРТЕ, КООРДИНАТ ТОЧЕК, ГЕОМЕТРИЧЕСКИХ И СЕМАНТИЧЕСКИХ ХАРАКТЕРИСТИК КАРТОГРАФИЧЕСКИХ ОБЪЕКТОВ В ИНТЕРАКТИВНОМ РЕЖИМЕ ПРИ РАБОТЕ С ТРАДИЦИОННОЙ КАРТОЙ В УСЛОВИЯХ ОТСУТСТВИЯ СВЯЗИ ДЛЯ ПЕРЕДАЧИ ЦИФРОВЫХ ДАННЫХ","Лисицкий Д.В., Комиссарова Е.В., Колесников А.А.","81. Патент на изобретение RU 2757066 C2, 11.10.2021. Заявка № 2019116623 от 29.05.2019.",,,,
707733,47435620,https://elibrary.ru/item.asp?id=47435620,ШАБЛОНИЗАТОР ДЛЯ СОСТАВЛЕНИЯ ПРОГРАММ КОНФЕРЕНЦИЙ,"Бугаков П.Ю., Колесников А.А.","82. Свидетельство о регистрации программы для ЭВМ RU 2021680232, 08.12.2021. Заявка № 2021669947 от 08.12.2021.",,,,
707733,47435623,https://elibrary.ru/item.asp?id=47435623,РАСЧЕТ УЧЕБНОЙ НАГРУЗКИ ДЛЯ ИНДИВИДУАЛЬНОГО ПЛАНА ПРЕПОДАВАТЕЛЯ,"Колесников А.А., Бугаков П.Ю.","83. Свидетельство о регистрации программы для ЭВМ RU 2021680234, 08.12.2021. Заявка № 2021669950 от 08.12.2021.",,,,
