author_id,item_id,item_url,title,authors,certificate_or_type,journal_name,journal_url,issue,issue_url,keywords,abstract,details_fetched
707733,88919190,https://elibrary.ru/item.asp?id=88919190,ПРОГРАММА ДЛЯ УПРАВЛЕНИЯ КОМПЛЕКСОМ ДАТЧИКОВ УСТРОЙСТВА «ИЗМЕРИТЕЛЬ ГЕОМЕТРИЧЕСКИХ ХАРАКТЕРИСТИК ОБЪЕКТОВ ГОРОДСКОЙ ИНФРАСТРУКТУРЫ»,"Бугаков П.Ю., Колесников А.А., Батырова К.С., Головачев Н.С.","1. Свидетельство о регистрации программы для ЭВМ RU 2026610667, 15.01.2026. Заявка № 2025697775 от 29.12.2025.",,,,,,"Программа предназначена для управления комплексом датчиков устройства «Измеритель геометрических характеристик объектов городской инфраструктуры» на базе Arduino. Возможна работа как в режиме реального времени, так и в автономном режиме с сохранением ключевых измерений во внутреннюю энергонезависимую память устройства для последующего анализа в рамках гранта Правительства Новосибирской области молодым ученым. Функциональные возможности программы: опрос подключенных датчиков, обработка первичных данных с датчиков, включая ильтрацию и расчет производных величин (углы наклона по двум осям, угол на основе показаний дальномера), прием и обработка управляющих команд, поступающих по беспроводному каналу связи (Bluetooth/Serial), для получения данных с конкретного датчика, передача обработанных данных на внешнее устройство по беспроводному каналу связи в текстовом формате. Тип ЭВМ: платформа Arduino Mega; ОС: компиляция через Arduino IDE.",1
707733,91607476,https://elibrary.ru/item.asp?id=91607476,АНАЛИЗ МЕТОДОВ ИНТЕРПРЕТАЦИИ МОДЕЛЕЙ КОМПЬЮТЕРНОГО ЗРЕНИЯ ПРИ ПОСТРОЕНИИ КОНТУРОВ УЧАСТКОВ ОТКРЫТЫХ ГОРНЫХ РАБОТ,"Колесников А.А., Резник А.В., Белослудцева А.А., Гаврилов В.Л., Медведева К.Е.",2. Физико-технические проблемы разработки полезных ископаемых . 2026. № 2 . С. 143-156.,Физико-технические проблемы разработки полезных ископаемых,https://elibrary.ru/contents.asp?id=91607462,№ 2,https://elibrary.ru/contents.asp?id=91607462&selid=91607476,ИНТЕРПРЕТАЦИЯ МОДЕЛЕЙ; СПУТНИКОВЫЕ СНИМКИ; МАШИННОЕ ОБУЧЕНИЕ; СЕГМЕНТАЦИЯ ИЗОБРАЖЕНИЙ; ОТКРЫТЫЕ ГОРНЫЕ РАБОТЫ; ДОБЫЧА; НАРУШЕННЫЕ ТЕРРИТОРИИ,"Рассмотрены методы интерпретации моделей машинного обучения, применяемые для сегментации участков открытой добычи полезных ископаемых по спутниковым снимкам. Проведена проверка моделей по материалам нарушенных горными работами территорий Новосибирской области и ряда районов Якутии, приведены примеры формирования и изменения в динамике контуров таких территорий. Проанализированы различные подходы к объяснению решений моделей компьютерного зрения, включая Grad-CAM, Saliency Maps, Feature Maps, Occlusion Sensitivity, Integrated Gradients и Counterfactual Explanations. Результаты исследования демонстрируют преимущества и недостатки каждого из этих методов и показывают, что увеличение количества итераций обучения не всегда приводит к улучшению качества модели. Предложены рекомендации по выбору методов интерпретации исходных данных, учитывающие особенности объектов наблюдений при решении конкретных геотехнологических и геоэкологических задач.",1
707733,89002354,https://elibrary.ru/item.asp?id=89002354,МЕТОДЫ СБОРА И АКТУАЛИЗАЦИИ МНОГОМЕРНЫХ ДАННЫХ ДЛЯ ЦЕЛЕЙ СОЗДАНИЯ ГЕОИНФОРМАЦИОННОЙ СИСТЕМЫ ДОСТУПНОСТИ ГОРОДСКОЙ ИНФРАСТРУКТУРЫ,"Головачев Н.С., Бугаков П.Ю., Колесников А.А.",3. Вестник СГУГиТ (Сибирского государственного университета геосистем и технологий) . 2026. Т. 31. № 1 . С. 72-82.,Вестник СГУГиТ (Сибирского государственного университета геосистем и технологий),https://elibrary.ru/contents.asp?id=89002347,№ 1,https://elibrary.ru/contents.asp?id=89002347&selid=89002354,ГЕОИНФОРМАЦИОННАЯ СИСТЕМА; ДОСТУПНОСТЬ ГОРОДСКОЙ ИНФРАСТРУКТУРЫ; МНОГОМЕРНЫЕ ДАННЫЕ; КРАУДСОРСИНГ; ВЕРИФИКАЦИЯ ДАННЫХ; МАЛОМОБИЛЬНЫЕ ГРУППЫ НАСЕЛЕНИЯ,"В статье рассматриваются методы сбора и актуализации многомерных данных для построения геоинформационной системы доступности городской инфраструктуры для маломобильных групп населения. Предложены подходы комбинированного использования официальных каналов и краудсорсинга для оперативного обновления сведений о препятствиях и объектах безбарьерной среды. Описана концептуальная модель системы, включающая многомерную карту с пространственными и временными измерениями, а также алгоритм верификации пользовательских сообщений на основе ролей и метаданных фотографий. Представлена структура базы данных и архитектура серверного модуля обработки запросов, включающего прием данных, расчет маршрутов и систему визуализации. Обозначены требования к веб-интерфейсу и мобильному приложению для разных категорий пользователей. Предложены меры по обеспечению достоверности, безопасности и актуальности данных.",1
707733,89334572,https://elibrary.ru/item.asp?id=89334572,МЕТОДОЛОГИЧЕСКИЕ АСПЕКТЫ ИСПОЛЬЗОВАНИЯ ИСКУССТВЕННОГО ИНТЕЛЛЕКТА В КАРТОГРАФИИ,"Колесников А.А., Лисицкий Д.В., Пошивайло Я.Г., Янкелевич С.С.",4. Вестник СГУГиТ (Сибирского государственного университета геосистем и технологий) . 2026. Т. 31. № 2 . С. 75-87.,Вестник СГУГиТ (Сибирского государственного университета геосистем и технологий),https://elibrary.ru/contents.asp?id=89334564,№ 2,https://elibrary.ru/contents.asp?id=89334564&selid=89334572,КАРТОГРАФИЯ; ИСКУССТВЕННЫЙ ИНТЕЛЛЕКТ; ГЕОПРОСТРАНСТВЕННЫЙ ИСКУССТВЕННЫЙ ИНТЕЛЛЕКТ; ПРОФЕССИОНАЛЬНЫЕ КАРТОГРАФИЧЕСКИЕ ЗНАНИЯ; ГЕОПРОСТРАНСТВЕННЫЙ СИТУАЦИОННЫЙ МОНИТОРИНГ,"Статья посвящена актуальной проблеме применения технологий искусственного интеллекта (ИИ) в картографии. Авторы обосновывают необходимость перехода к полной автоматизации картографических процессов в условиях лавинообразного роста объема пространственных данных и повышения требований к скорости их обработки, вплоть до режима реального времени. Особую значимость этим исследованиям в России придают национальные проекты по созданию многоспутниковой орбитальной группировки и Национальной системы пространственных данных (НСПД). На основе анализа зарубежных и отечественных публикаций рассматриваются эволюция и современное состояние темы - от ранних экспертных систем до современной парадигмы Геопространственного ИИ (GeoAI). Выделены ключевые преимущества, тенденции, модели, приложения и этические вызовы, связанные с интеграцией ИИ в картографию. В статье сформулированы основные проблемы, сдерживающие развитие направления в России, включая недостаточную разработанность теоретико-методологической и семантической основы, отсутствие структурированной базы профессиональных знаний и отставание в создании конкурентоспособных отечественных ГИС-платформ...",1
707733,91608799,https://elibrary.ru/item.asp?id=91608799,ПРОГНОЗИРОВАНИЕ УРОЖАЙНОСТИ КУКУРУЗЫ МЕТОДАМИ МАШИННОГО ОБУЧЕНИЯ НА ОСНОВЕ РЕЗУЛЬТАТОВ ГЕОИНФОРМАЦИОННОГО АНАЛИЗА ТВЕРДОСТИ ПОЧВЫ,"Колесников А.А., Яковлев Д.А., Пошивайло Я.Г., Иванов Н.М., Костич М., Брычева А.В., Бамбух Д.В.",5. Известия Томского политехнического университета. Инжиниринг георесурсов . 2026. Т. 337. № 5 . С. 21-35.,Известия Томского политехнического университета. Инжиниринг георесурсов,https://elibrary.ru/contents.asp?id=91608796,№ 5,https://elibrary.ru/contents.asp?id=91608796&selid=91608799,ТВЕРДОСТЬ ПОЧВЫ; ПРОГНОЗИРОВАНИЕ УРОЖАЙНОСТИ КУКУРУЗЫ; ТОЧНОЕ ЗЕМЛЕДЕЛИЕ; ГЕОИНФОРМАЦИОННЫЙ АНАЛИЗ; ИНТЕРПОЛЯЦИЯ; КЛАСТЕРИЗАЦИЯ; ТЕПЛОВАЯ КАРТА; МАШИННОЕ ОБУЧЕНИЕ,"Актуальность. Одной из важнейших сфер применения геопространственных технологий и технологий искусственного интеллекта является точное земледелие, которое подразумевает индивидуальный подход к отдельным участкам поля, что способствует повышению эффективности сельскохозяйственного производства. Выбор сельскохозяйственной культуры для исследования обусловлен тем фактом, что кукуруза является достаточно перспективной и высокомаржинальной культурой. Например, с 2001 по 2024 гг. отмечается увеличение посевных площадей кукурузы в 4 раза (на 1960,5 тыс. га), что говорит о перспективах развития данного направления растениеводства. Процесс роста и развития растений кукурузы во многом зависит от физических свойств почвы. В рамках реализации элементов технологии точного земледелия по значениям твердости почвы был выполнен геоинформационный анализ с целью выявления зон почвенных неоднородностей. На основании результатов зонирования осуществлялся выбор наиболее эффективных методов машинного обучения для прогнозирования урожайности зеленой массы кукурузы в зависимости от твердости почвы...",1
707733,84122014,https://elibrary.ru/item.asp?id=84122014,БАЗА ДАННЫХ МАТЕРИАЛОВ ТРАВЕЛОГОВ ДЛЯ РЕПРЕЗЕНТАЦИИ ПРОСТРАНСТВА УКРАИНЫ В РУССКОЙ КУЛЬТУРЕ КОНЦА XVIII – XIX ВЕКОВ,"Алексеев П.В., Жданов С.С., Колесников А.А.","6. Свидетельство о регистрации базы данных RU 2025625201, 17.11.2025. Заявка № 2025624936 от 07.11.2025.",,,,,,"База данных предназначена для систематизации и анализа описаний украинских земель в русских травелогах указанного периода. Цель - выявить и структурировать ключевые образы, топосы и нарративы, формировавшие восприятие Украины в имперском культурном сознании; позволяет проводить многоаспектный анализ текстов, отслеживая трансформацию образов конкретных локусов, их символическое наполнение и связь с историческими событиями и персоналиями. База данных применима для: систематизации описания географических объектов из различных источников; выделения ключевых локусы и сублокусы, формирующие образ региона; анализа символического и идеологического наполнения пространства через описания, оценки и упоминания исторических фигур; демонстрации механизмов репрезентации пространства через сопряжение топографии, памятной инфраструктуры и риторики, фиксации локальных экономико-социальных черт. База данных создана в рамках Гранта РНФ №24-28-01431. Тип ЭВМ: IBM PC-совмест. ПК. ОС: Windows 10.",1
707733,84126766,https://elibrary.ru/item.asp?id=84126766,ПРОГРАММА ДЛЯ АВТОМАТИЧЕСКОГО ФОРМИРОВАНИЯ WEB-КАРТЫ НА ОСНОВЕ ТЕКСТОВЫХ МАТЕРИАЛОВ ТРАВЕЛОГОВ,"Жданов С.С., Колесников А.А.","7. Свидетельство о регистрации программы для ЭВМ RU 2025690407, 07.11.2025. Заявка № 2025690024 от 07.11.2025.",,,,,,"Программа представляет собой интерактивное веб-приложение, предназначенное для автоматизации рабочего процесса по извлечению географических сущностей из текстовых документов травелогов, их геокодированию (привязке к координатам) и визуализации на интерактивной карте. Функциональные возможности программы: извлечение информации из сканированных документов, сегментация и анализ текста травелогов с помощью больших языковых моделей, геокодирование, представление результатов на интерактивной карте. Программа может быть использована для анализа исторических карт и архивных документов, геоаналитики в научных исследованиях, экологии, географии, автоматизация сбора данных из бумажных или сканированных отчетов, интеграции в ГИС-системы и цифровые карты. Грант РНФ № 24-28-01431",1
707733,84126767,https://elibrary.ru/item.asp?id=84126767,ПРОГРАММА ДЛЯ ФОРМИРОВАНИЯ И ИСПОЛЬЗОВАНИЯ БАЗЫ ЗНАНИЙ МАТЕРИАЛОВ ТРАВЕЛОГОВ,"Жданов С.С., Колесников А.А.","8. Свидетельство о регистрации программы для ЭВМ RU 2025690408, 07.11.2025. Заявка № 2025690025 от 07.11.2025.",,,,,,"Программа представляет собой web‑приложение для построения локальной базы знаний из текстовых материалов травелогов с возможностью диалогового поиска ответов по принципу Retrieval-Augmented Generation (RAG). Система извлекает текст из документов, разрезает на фрагменты, строит эмбеддинги, индексирует их в Qdrant и при запросе пользователя находит релевантные фрагменты и формирует ответ с помощью локальной и внешней большой языковой модели, строго опираясь на найденный контекст. Функциональность программы: загрузка и обработка текстовых документов, векторизация и индексирование, поиск и генерация ответов на основе механизмов RAG. Программа может быть использована для навигации по внутренней документации (регламенты, инструкции, технические спецификации), аналитики и изучения документов, поиска ответов в учебных материалах, методичках, конспектах. Грант РНФ № 24-28-01431",1
707733,87699251,https://elibrary.ru/item.asp?id=87699251,ГЕОПРОСТРАНСТВЕННАЯ БАЗА ДАННЫХ КОМПЛЕКСНОГО ГЕОДЕЗИЧЕСКОГО МОНИТОРИНГА,"Казанцева В.В., Косарев Н.С., Колесников А.А.","9. Свидетельство о регистрации базы данных RU 2025625538, 27.11.2025. Заявка № 2025625133 от 13.11.2025.",,,,,,"База данных представляет собой интегрированную систему хранения, обработки и анализа геопространственных данных, предназначенную для обеспечения комплексного геодезического мониторинга откосов карьеров и отвалов. База данных содержит взаимосвязанные слои и таблицы, объединяющие результаты инструментальных измерений, данных дистанционного зондирования, цифровых моделей рельефа, геотехнических и гидрогеологических характеристик породного массива. База данных реализована на основе реляционной модели и структурирована по принципам иерархичности данных. Каждая запись связана с конкретным объектом наблюдения и включает параметры пространственного положения, времени съёмки, метода наблюдения и полученные физико-механические характеристики. В базу данных интегрированы результаты фотограмметрической обработки в формате .OBJ и .LAZ, что позволяет включать в базу цифровые модели рельефа и поверхности. Совокупность самостоятельных признаков: хранение в БД результатов инструментальных измерений, данных дистанционного зондирования, цифровых моделей рельефа, геотехнических и гидрогеологических характеристик породного массива; принцип иерархичности данных интеграция; каждая запись связана с конкретным объектом наблюдения и включает параметры пространственного положения, времени съёмки, метода наблюдения и полученные физико-механические характеристики; визуализация информации из базы данных в виде графических объектов в геоинформационной системе...",1
