author_id,item_id,item_url,title,authors,certificate_or_type,journal_name,journal_url,issue,issue_url,keywords,abstract,details_fetched
707733,42409403,https://elibrary.ru/item.asp?id=42409403,ИСПОЛЬЗОВАНИЕ ЧЕТЫРЕХМЕРНЫХ СВЕРТОЧНЫХ НЕЙРОННЫХ СЕТЕЙ ДЛЯ АВТОМАТИЗАЦИИ ПОСТРОЕНИЯ МОДЕЛЕЙ МЕСТНОСТИ,"Колесников А.А., Кикин П.М.",139. В сборнике: Марчуковские научные чтения - 2019. Труды Международной конференции. 2019. С. 240-245.,,,,,ОБЛАКО ТОЧЕК; СЕМАНТИЧЕСКАЯ СЕГМЕНТАЦИЯ; СВЕРТОЧНАЯ НЕЙРОННАЯ СЕТЬ,"Описаны способы, особенности и проблемы использования многомерных сверточных нейронных сетей для семантической сегментации облаков точек, полученных как по результатам съемки в помещениях, так и на открытой местности. Приводятся предлагаемые классификации типов нейронных сетей для трехмерной семантической сегментации и моделей, распределенных по принципу ориентации на обработку определенного типа пространственных данных. Сформирован сводный список эталонных тестов для оценки результатов семантической сегментации облаков точек съемки помещений, городской застройки, отдельных строений, частей механизмов и бытовых инструментов.",1
707733,41310765,https://elibrary.ru/item.asp?id=41310765,ПРЕПОДАВАНИЕ СОВРЕМЕННЫХ МЕТОДОВ ОБРАБОТКИ ДАННЫХ В РАМКАХ ДИСЦИПЛИН НАПРАВЛЕНИЙ ГЕОИНФОРМАТИКА И КАРТОГРАФИЯ,Колесников А.А.,140. В сборнике: ПРЕПОДАВАНИЕ ИНФОРМАЦИОННЫХ ТЕХНОЛОГИЙ В РОССИЙСКОЙ ФЕДЕРАЦИИ. Материалы Семнадцатой открытой Всероссийской конференции. Ответственный редактор А. В. Альминдеров. 2019. С. 315-317.,,,,,АНАЛИЗ ДАННЫХ; ГЕОИНФОРМАТИКА; КАРТОГРАФИЯ; ЦИФРОВАЯ ЭКОНОМИКА,"Доклад посвящен вопросам подготовки специалистов в области картографии и геоинформатики с учетом современных тенденций в области обработки и анализа данных. Рассматриваются те разделы Data Science, которые рекомендуется включать в дисциплины этого направления подготовки, а также описаны особенности использования программного обеспечения для проведения практических занятий. Приведены основные мероприятия, которые на теоретическом и практическом уровнях позволят расширить текущие компетенции обучающихся с учетом направления развития цифровой экономики РФ.",1
707733,41376589,https://elibrary.ru/item.asp?id=41376589,ПРОГНОЗИРОВАНИЕ РАСПРОСТРАНЕНИЯ БОЛЕЗНЕЙ В ТРОПИЧЕСКИХ ЗОНАХ С ПОМОЩЬЮ МЕТОДОВ МАШИННОГО ОБУЧЕНИЯ,"Колесников А.А., Кикин П.М.",141. В сборнике: Обработка пространственных данных в задачах мониторинга природных и антропогенных процессов (SDM-2019). Сборник трудов всероссийской конференции с международным участием. 2019. С. 371-376.,,,,,ТРОПИЧЕСКИЕ БОЛЕЗНИ; ЛИХОРАДКА; МАШИННОЕ ОБУЧЕНИЕ; ГЕОСТАТИСТИКА; НЕЙРОННЫЕ СЕТИ,"Заражение тропическими паразитарными болезнями, по данным ВОЗ, оказывают огромное влияние на здоровье более 40 миллионов человек во всем мире и являются второй по значимости причиной иммунодефицита. На количество заражений влияют многие факторы - климатические, демографические, растительный покров и ряд других. В статье представлено исследование и оценка степени влияния каждого из этих факторов, а также сравнение качества прогнозирования отдельными методами геоинформационного анализа и машинного обучения и возможности их ансамблирования.",1
707733,41313824,https://elibrary.ru/item.asp?id=41313824,ПРОСТРАНСТВЕННО-ВРЕМЕННОЕ МОДЕЛИРОВАНИЕ ЭКОЛОГИЧЕСКИХ ПОКАЗАТЕЛЕЙ С ИСПОЛЬЗОВАНИЕМ МЕТОДОВ МАШИННОГО ОБУЧЕНИЯ,"Колесников А.А., Кикин П.М.",142. В сборнике: Тезисы XX Всероссийской конференции молодых учёных по математическому моделированию и информационным технологиям. 2019. С. 61-62.,,,,,,,1
707733,37393508,https://elibrary.ru/item.asp?id=37393508,ПРОБЛЕМЫ И ПЕРСПЕКТИВЫ ИСПОЛЬЗОВАНИЯ СИСТЕМ ИСКУССТВЕННОГО ИНТЕЛЛЕКТА ДЛЯ ОБРАБОТКИ ПРОСТРАНСТВЕННЫХ ДАННЫХ,"Колесников А.А., Криволуцкая Т.С.","143. В сборнике: Геодезия, землеустройство и кадастры: проблемы и перспективы развития, посвященная 100-летию советской геодезии и картографии. Сборник материалов I Международной научно-практической конференции. 2019. С. 71-74.",,,,,ИСКУССТВЕННЫЙ ИНТЕЛЛЕКТ; ПРОСТРАНСТВЕННЫЕ ДАННЫЕ; МАШИННОЕ ОБУЧЕНИЕ; ПРОБЛЕМЫ; ПЕРСПЕКТИВЫ,"В статье перечислены проблемы, которые существуют в настоящий момент в области использования систем искусственного интеллекта, а также перспективы и направления использования этих систем в геодезии, картографии, геоинформатике и других науках, связанных с обработкой всех типов пространственных данных. Приведенные положения сформулированы на основе собственных исследований авторов и трудов ведущих ученых, лабораторий и организаций.",1
707733,43248371,https://elibrary.ru/item.asp?id=43248371,FORECASTING THE DISTRIBUTION OF DISEASES IN TROPICAL ZONES USING MACHINE LEARNING METHODS,"Kolesnikov A.A., Kikin P.M.","144. В сборнике: CEUR Workshop Proceedings. SDM 2019 - Proceedings of the All-Russian Conference ""Spatial Data Processing for Monitoring of Natural and Anthropogenic Processes"". 2019. С. 371-376.",,,,,FEVER; GEOSTATISTICS; MACHINE LEARNING; NEURAL NETWORKS; TROPICAL DISEASES,"Infection with tropical parasitic diseases, according to WHO, has a huge impact on the health of more than 40 million people worldwide and is the second leading cause of immunodeficiency. The number of infections is influenced by many factors - climatic, demographic, vegetation cover and a number of others. The article presents a study and an assessment of the degree of influence of each of these factors, as well as a comparison of the quality of forecasting by separate methods of geo-informational analysis and machine learning and the possibility of their ensemble.",1
707733,41713136,https://elibrary.ru/item.asp?id=41713136,"USE OF MACHINE LEARNING TECHNIQUES FOR RAPID DETECTION, ASSESSMENT AND MAPPING THE IMPACT OF DISASTERS ON TRANSPORT INFRASTRUCTURE","Kikin P.M., Kolesnikov A.A., Portnov A.M.","145. В сборнике: International Archives of the Photogrammetry, Remote Sensing and Spatial Information Sciences - ISPRS Archives. 2019. С. 195-200.",,,,,ARTIFICIAL NEURAL NETWORKS; MACHINE LEARNING; RAPID MAPPING; ROAD NETWORK; UAV; U-NET,"Road traffic infrastructure plays a key role in emergency management. It allows to evacuate people from the affected area in the shortest possible time, as well as to organize rapid emergency response. However, disasters often cause the destruction of roads, railways and pedestrian routes, which can significantly affect the evacuation plan and availability of facilities for emergency services, which increases the response time and thereby increases the losses. Therefore, it is very important to quickly provide emergency services with necessary post-disaster maps, created on the principles of rapid mapping. Change detection based on geospatial data before and after damage can make rapid and automatic assessment possible with reasonable accuracy and speed. This research proposes a new approach for detecting damage and detecting the state and availability of the road network based on the satellite imagery data, unmanned aerial vehicles (UAVs) and SAR using various methods of image analysis. We also provided an assessment of the resulting combined mathematical model based on neural networks and spatial analysis approaches.",1
707733,41714738,https://elibrary.ru/item.asp?id=41714738,DISEASES SPREAD PREDICTION IN TROPICAL AREAS BY MACHINE LEARNING METHODS ENSEMBLING AND SPATIAL ANALYSIS TECHNIQUES,"Kolesnikov A.A., Kikin P.M., Portnov A.M.","146. В сборнике: International Archives of the Photogrammetry, Remote Sensing and Spatial Information Sciences - ISPRS Archives. 2019. С. 221-226.",,,,,DISEASE SPREAD; ENSEMBLING; LSTM; MACHINE LEARNING,"Infection with tropical parasitic diseases has a great economic and social impact and is currently one of the most pressing health problem. These diseases, according to WHO, have a huge impact on the health of more than 40 million people worldwide and are the second leading cause of immunodeficiency. Developing countries may be providers of statistical data, but need help with forecasting and preventing epidemics. The number of infections is influenced by many factors-climatic, demographic, vegetation cover, land use, geomorphology. The purpose of the research is to investigate the space-time patterns, the relationship between diseases and environmental factors, assess the degree of influence of each of the factors, compare the quality of forecasting of individual techniques of geo-information analysis and machine learning and the way they are ensembled. Also we attempt to create a generalized mathematical model for predicting several types of diseases. The following resources were used as a data source: International Society for Infectious Diseases, Landsat, Sentinel. The paper concludes with the summary table containing the importance of individual climatic, social and spatial aspects affecting the incidence. The most effective predictions were given by a mathematical model based on a combination of spatial analysis techniques (MGWR) and neural networks based on the LSTM architecture.",1
707733,41410781,https://elibrary.ru/item.asp?id=41410781,СОЗДАНИЕ КАРТЫ ЗАСЕЛЕНИЯ ДОВОЛЕНСКОГО РАЙОНА НОВОСИБИРСКОЙ ОБЛАСТИ С ПРИМЕНЕНИЕМ QR-КОДОВ,"Байшуаков А.Т., Колесников А.А., Комиссарова Е.В.",147. В сборнике: Интеллектуальный потенциал Сибири. 27-я Региональная научная студенческая конференция: сборник научных трудов. В 2-х частях. Под редакцией Д.О. Соколовой. 2019. С. 307-309.,,,,,КАРТА; QR-КОДЫ; ИСТОРИЯ; СОЗДАНИЕ,В работе рассматривается применение QR-кодов для создания карты заселения Доволенского района Новосибирской области.,1
707733,41410799,https://elibrary.ru/item.asp?id=41410799,ПРИМЕНЕНИЕ QR-КОДОВ В КАРТОГРАФИИ,"Кузнецов С.А., Сотникова А.Ю., Колесников А.А.",148. В сборнике: Интеллектуальный потенциал Сибири. 27-я Региональная научная студенческая конференция: сборник научных трудов. В 2-х частях. Под редакцией Д.О. Соколовой. 2019. С. 341-343.,,,,,ИНФОРМАЦИОННАЯ ЕМКОСТЬ; ТРАДИЦИОННЫЕ КАРТЫ; QR-КОД,"Несмотря на достаточно хорошую степень исследованности традиционных печатных карт, тем не менее найден новый способ увеличения информационной емкости карты и тем самым частично разрешить существующее противоречие между наглядностью и читаемостью карты. Одним из таких способов является использование технологии QR-кодов. В докладе рассмотрены базовые возможности QR-кодов, обеспечивающие интерес к этой технологии. В результате исследований выделен ряд достоинств использования QR-кодов при создании традиционных карт. Исследование технологий с применение QR-кодов в картографии имеет как научное, так и прикладное значение в аспекте создания традиционных карт различного содержания и назначения.",1
707733,41670673,https://elibrary.ru/item.asp?id=41670673,ПРИМЕНЕНИЕ QR-КОДОВ В КАРТОГРАФИИ,"Кузнецов С.А., Сотникова А.Ю., Колесников А.А.",149. В сборнике: Интеллектуальный потенциал Сибири. 27-я Региональная научная студенческая конференция: в 3 частях. 2019. С. 315-319.,,,,,ТРАДИЦИОННЫЕ КАРТЫ; МОБИЛЬНЫЕ УСТРОЙСТВА; QR-КОДЫ; ИНТЕРАКТИВНЫЙ РЕЖИМ; ОБЪЕМЫ КАРТОГРАФИЧЕСКОЙ ИНФОРМАЦИИ,"Статья посвящена своевременной и актуальной на сегодняшний день проблеме применения QR-кодов картографии. Изложены задачи, этапы и промежуточные итоги проекта по разработке нового вида интерактивного картографического произведения. В ходе реализации проекта изучены особенности QR-кодов, рассмотрены возможности расширения информационной емкости традиционных печатных карт с помощью мобильных устройств и QR-кодов, выделены базовые возможности их использования при создании нового вида карты, достоинства и недостатки применения мобильных устройств и QR- кодов при создании и использования традиционной бумажной карты.",1
707733,41217742,https://elibrary.ru/item.asp?id=41217742,РАСШИРЕНИЕ ИНФОРМАЦИОННОЙ ЕМКОСТИ ТРАДИЦИОННЫХ КАРТ С ПОМОЩЬЮ QR-КОДОВ,"Лисицкий Д.В., Колесников А.А., Комиссарова Е.В., Сотникова А.Ю.",150. Интерэкспо Гео-Сибирь . 2019. Т. 1. № 2 . С. 102-110.,Интерэкспо Гео-Сибирь,https://elibrary.ru/contents.asp?id=41217728,№ 2,https://elibrary.ru/contents.asp?id=41217728&selid=41217742,ИНФОРМАЦИОННАЯ ЕМКОСТЬ; ТРАДИЦИОННЫЕ КАРТЫ; QR-КОД; EXTENSION; INFORMATION CAPACITY; TRADITIONAL MAPS; QR-CODE,"Несмотря на достаточно хорошую степень исследованности традиционных печатных карт, тем не менее еще можно найти новые способы увеличения информационной емкости карты и тем самым частично разрешить существующее противоречие между наглядностью и читаемостью карты. Одним из таких способов является использование технологии QR-кодов. В статье рассмотрены базовые возможности QR-кодов, обеспечивающие интерес к этой технологии. В результате исследований выделен ряд достоинств использования QR-кодов при создании традиционных карт. Исследование технологий с применение QR-кодов в картографии имеет как научное, так и прикладное значение в аспекте создания традиционных карт различного содержания и назначения.",1
707733,41217747,https://elibrary.ru/item.asp?id=41217747,НОВЫЙ ВИД ИНТЕРАКТИВНОГО КАРТОГРАФИЧЕСКОГО ПРОИЗВЕДЕНИЯ,"Лисицкий Д.В., Колесников А.А., Комиссарова Е.В., Кузнецов С.А.",151. Интерэкспо Гео-Сибирь . 2019. Т. 1. № 2 . С. 145-152.,Интерэкспо Гео-Сибирь,https://elibrary.ru/contents.asp?id=41217728,№ 2,https://elibrary.ru/contents.asp?id=41217728&selid=41217747,ТРАДИЦИОННЫЕ КАРТЫ; МОБИЛЬНЫЕ УСТРОЙСТВА; QR-КОДЫ; ИНТЕРАКТИВНЫЙ РЕЖИМ; ОБЪЕМЫ КАРТОГРАФИЧЕСКОЙ ИНФОРМАЦИИ; PAPER MAPS; MOBILE DEVICES; QR CODES; INTERACTIVE MODE; AMOUNT OF CARTOGRAPHIC INFORMATION,"На сегодняшний день нет общей методики создания и использования традиционных (бумажных) карт в интерактивном режиме с применением мобильных устройств и QR-кодов. В статье сформулированы цель и задачи исследования по разработке нового вида интерактивного картографического произведения. В результате изучения особенностей QR-кодов, рассмотрения возможностей расширения информационной емкости традиционных печатных карт с помощью мобильных устройств и QR-кодов, выделены базовые возможности использования их при создании нового вида карты, достоинства и недостатки применения мобильных устройств и QR-кодов при создании и использовании традиционной бумажной карты.",1
707733,42513850,https://elibrary.ru/item.asp?id=42513850,АНАЛИЗ ФУНКЦИОНАЛЬНЫХ ВОЗМОЖНОСТЕЙ ОФИСНЫХ ПРИЛОЖЕНИЙ ДЛЯ ВИЗУАЛИЗАЦИИ И ОЦЕНКИ ГЕОДАННЫХ,"Бугаков П.Ю., Колесников А.А.",152. Вестник СГУГиТ (Сибирского государственного университета геосистем и технологий) . 2019. Т. 24. № 4 . С. 104-119.,Вестник СГУГиТ (Сибирского государственного университета геосистем и технологий),https://elibrary.ru/contents.asp?id=42513841,№ 4,https://elibrary.ru/contents.asp?id=42513841&selid=42513850,ВИЗУАЛИЗАЦИЯ; ПРОСТРАНСТВЕННЫЕ ДАННЫЕ; ГЕОИНФОРМАЦИЯ; ТЕМАТИЧЕСКАЯ КАРТА; АГРЕГИРОВАНИЕ ДАННЫХ; ОФИСНЫЕ ПРИЛОЖЕНИЯ; VISUALIZATION; SPATIAL DATA; GEOINFORMATION; THEMATIC MAP; DATA AGGREGATION; OFFICE APPLICATIONS,"Возможности по визуализации и анализу пространственных данных перестают быть прерогативой только геоинформационных систем и добавляются в функционал прикладного программного обеспечения и web-сервисов. Целью работы является формирование критериев и анализ функциональных возможностей геоинформационной составляющей современных офисных и аналитических платформ. Критерии охватывают полный цикл использования пространственной информации: загрузка данных, их оценка, нанесение на карту, настройка отображения, анализ и построение прогнозов. Исследование проводилось на примере надстройки Microsoft 3D Maps для офисного табличного процессора Excel, а также программных средств интерактивной бизнес-аналитики Microsoft Power BI и Tableau. Для практической апробации выбранного программного обеспечения и выполнения анализа по сформулированной системе групп критериев использовалось несколько наборов структурированных данных из различных источников на территорию Российской Федерации и города Новосибирска...",1
707733,41155828,https://elibrary.ru/item.asp?id=41155828,ОТБОР КАРТОГРАФИЧЕСКИХ ПАРАМЕТРОВ ДЛЯ ПОСТРОЕНИЯ МАТЕМАТИЧЕСКОЙ МОДЕЛИ ПРОГНОЗИРОВАНИЯ ТИПОВ РАСТИТЕЛЬНОГО ПОКРОВА,"Колесников А.А., Комиссарова Е.В., Криволуцкая Т.С., Грищенко Д.В.","153. Регулирование земельно-имущественных отношений в России: правовое и геопространственное обеспечение, оценка недвижимости, экология, технологические решения . 2019. Т. 1. С. 134-138.","Регулирование земельно-имущественных отношений в России: правовое и геопространственное обеспечение, оценка недвижимости, экология, технологические решения",https://elibrary.ru/contents.asp?id=41155801,,,ОТБОР ПАРАМЕТРОВ; ТИПЫ РАСТИТЕЛЬНОГО ПОКРОВА; ПРОГНОЗИРОВАНИЕ; МАШИННОЕ ОБУЧЕНИЕ; FEATURE IMPORTANCE; BORUTA; SELECTION OF PARAMETERS; TYPES OF LAND COVER; FORECASTING; MACHINE LEARNING,В статье описываются наиболее популярные алгоритмы отбора параметров в моделях машинного обучения. Выполнено сравнительное исследование данных алгоритмов на примере задачи прогнозирования типов растительного покрова по набору картографических параметров.,1
